{
  "schema_version": 1,
  "test_id": "ui:tests/routes.spec.ts > Routes > sorts by time",
  "owner": "ravi",
  "jira_key": "PM-5679",
  "deadline": "2026-10-19",
  "rerun_evidence": "Passed on retry tonight; failed 3 of the last 7 nights with the same timeout.",
  "marked_by": "asha@gate6.com",
  "run_url": "https://github.com/arpanpandeygate6/poolbrain-qa/actions/runs/37213558288"
}
